{
  "schemaVersion": 1,
  "kind": "installed-state",
  "environment": "production",
  "release": "v0.0.1",
  "sourceCommit": "1111111111111111111111111111111111111111",
  "manifestSha256": "sha256:23548aa5c46a201dca27a3fd5361e8d2dbaf6e74c3e9e593c7c90410120873d8",
  "plannedAt": "2026-07-29T16:00:00Z",
  "installedAt": "2026-07-29T16:05:00Z",
  "reconciled": true,
  "components": [
    {
      "id": "backend",
      "immutableRef": "ghcr.io/greggorio/abaronesa-emporio-backend@sha256:0000000000000000000000000000000000000000000000000000000000000001"
    },
    {
      "id": "website_back",
      "immutableRef": "ghcr.io/greggorio/abaronesa-emporio-website-backend@sha256:0000000000000000000000000000000000000000000000000000000000000002"
    },
    {
      "id": "frontend",
      "immutableRef": "ghcr.io/greggorio/abaronesa-emporio-frontend@sha256:0000000000000000000000000000000000000000000000000000000000000003"
    },
    {
      "id": "website_front",
      "immutableRef": "ghcr.io/greggorio/abaronesa-emporio-website-frontend@sha256:0000000000000000000000000000000000000000000000000000000000000004"
    },
    {
      "id": "whatsapp_service",
      "immutableRef": "ghcr.io/greggorio/abaronesa-emporio-whatsapp-service@sha256:0000000000000000000000000000000000000000000000000000000000000005"
    },
    {
      "id": "gateway",
      "immutableRef": "ghcr.io/greggorio/abaronesa-emporio-gateway@sha256:0000000000000000000000000000000000000000000000000000000000000006"
    }
  ],
  "databases": [
    {
      "id": "erp",
      "ownerComponent": "backend",
      "migrationSetSha256": "sha256:156e6049bff42c10b187d5f269a68fc57562b5716c8ea0266b0891008acff5eb",
      "migrations": [
        {
          "path": "backend/src/main/resources/db/migration/V1__init.sql",
          "sha256": "sha256:d77a9755ee412a891e7f8651129a9ebf4d5fdfd86a8f42ad68529a9a58d6f800",
          "version": "1"
        },
        {
          "path": "backend/src/main/resources/db/migration/V2__dynamic_form_definitions.sql",
          "sha256": "sha256:dd69bf3489cb11f2c848da1eb6ef7f1f156b0673a253c20b2c0316d7c8615758",
          "version": "2"
        },
        {
          "path": "backend/src/main/resources/db/migration/V3__add_referencia_to_mesa.sql",
          "sha256": "sha256:fcb94f1a3fd5fc696e85b6c64ddabba2bf22035ff10517719dfa52d006339d4c",
          "version": "3"
        },
        {
          "path": "backend/src/main/resources/db/migration/V4__extend_referencia_to_mesa.sql",
          "sha256": "sha256:49d0f165021ec990cedb0cdc22c55a983a7422b63d056f5e46672b31053ee3ef",
          "version": "4"
        },
        {
          "path": "backend/src/main/resources/db/migration/V5__add_producao_propria_to_produto.sql",
          "sha256": "sha256:671f0880eeec415980c9e4d4b18cbb42f396fd331a0598d3b82e1e1bc03626e3",
          "version": "5"
        },
        {
          "path": "backend/src/main/resources/db/migration/V6__add_producao_propria_to_form.sql",
          "sha256": "sha256:b47ca613726b8017e01b3417f13af40cb00c447c1772ca82165f5d1d07039e58",
          "version": "6"
        },
        {
          "path": "backend/src/main/resources/db/migration/V20251223100000__create_sessao_cobrancas_table.sql",
          "sha256": "sha256:3cd22b73e6037e3ad0ea7e6ede58ad584b0fb0714f82dc403b5641fad9038a8f",
          "version": "20251223100000"
        },
        {
          "path": "backend/src/main/resources/db/migration/V20251224000000__add_valor_couvert_to_pagamento.sql",
          "sha256": "sha256:a414b58dbb735c109ad9efbd7bec5e237575b994a55a9c733fb6b95c8205be87",
          "version": "20251224000000"
        },
        {
          "path": "backend/src/main/resources/db/migration/V20251225000000__create_birthday_notification_log_table.sql",
          "sha256": "sha256:1df1cb9863436e95d5b035c6938dbddfa34853ed544a34d51708fb5a45b27b60",
          "version": "20251225000000"
        },
        {
          "path": "backend/src/main/resources/db/migration/V20251225001000__create_job_tables.sql",
          "sha256": "sha256:26a76753f8c426df2e01acb320a09bca8cae0fb23b19ec1aa6f20b55a2c7af47",
          "version": "20251225001000"
        },
        {
          "path": "backend/src/main/resources/db/migration/V20251225002000__create_event_notification_log_table.sql",
          "sha256": "sha256:638a2de3c998eac413bb19b7db643561b2f292de2ffbcad67f0669d27cfff621",
          "version": "20251225002000"
        },
        {
          "path": "backend/src/main/resources/db/migration/V20251228090000__create_delivery_order_tables.sql",
          "sha256": "sha256:ff5a100d847b438f5b833e576d2d1eac8849ecf3d9808ebb1f9e963b90ffe8c8",
          "version": "20251228090000"
        },
        {
          "path": "backend/src/main/resources/db/migration/V20251228090500__alter_delivery_order_raw_response_to_text.sql",
          "sha256": "sha256:71ec08174fc652af78c151c057593388d5e63494958ea96fbc63b6d130003c2f",
          "version": "20251228090500"
        },
        {
          "path": "backend/src/main/resources/db/migration/V20251228160000__add_uber_fields_to_delivery_order.sql",
          "sha256": "sha256:991676b3330256ee741a51b87e663417edd2237a2c95a0151e71c336184efcc5",
          "version": "20251228160000"
        },
        {
          "path": "backend/src/main/resources/db/migration/V20251228170000__add_kds_published_at_to_delivery_order.sql",
          "sha256": "sha256:020b0b552a668f3c1f9b623515f090feca42d9bdab64c2800b2a71742ebd5fde",
          "version": "20251228170000"
        },
        {
          "path": "backend/src/main/resources/db/migration/V20251228180000__create_payment_table.sql",
          "sha256": "sha256:6beb89721974d914a754d0b666a6a213c397342a267ec702ac59ce38716a9533",
          "version": "20251228180000"
        },
        {
          "path": "backend/src/main/resources/db/migration/V20251228180500__add_delivery_kds_archive.sql",
          "sha256": "sha256:cda1f5e686f1926b558f6621b67fdd66ca32ae1f9fd085c77919aedfdb502dd1",
          "version": "20251228180500"
        },
        {
          "path": "backend/src/main/resources/db/migration/V20251228190000__create_payment_settings_table.sql",
          "sha256": "sha256:4372affdbe635b856f0c127f1a3c19fee16c366ec32b93da98377d9029f0a867",
          "version": "20251228190000"
        },
        {
          "path": "backend/src/main/resources/db/migration/V20251229140000__add_provider_payment_fields_to_delivery_order.sql",
          "sha256": "sha256:2f8617b564a620af1c57f121f36228371f2e2e484f4198dbf8d2c0c385ebdbbf",
          "version": "20251229140000"
        },
        {
          "path": "backend/src/main/resources/db/migration/V20260104123000__add_self_checkout_fields_to_pagamento.sql",
          "sha256": "sha256:8d257fd5b7b67e01a52163ca73adfc1e92ee522b9d3a8382575c9ff9cc685e07",
          "version": "20260104123000"
        },
        {
          "path": "backend/src/main/resources/db/migration/V20260104130000__add_self_checkout_release_to_sessao_mesa.sql",
          "sha256": "sha256:55992b51f95af44c2706541ce116d71c614f633ef16bcadfd3618565d069bddb",
          "version": "20260104130000"
        },
        {
          "path": "backend/src/main/resources/db/migration/V20260105150000__create_print_agent_pairings.sql",
          "sha256": "sha256:288e92e4ccb6725b7f3a11300123ae7c2f65de960d3d7d7d7d4c2ead7fc54861",
          "version": "20260105150000"
        },
        {
          "path": "backend/src/main/resources/db/migration/V20260106150000__create_print_agent_status.sql",
          "sha256": "sha256:d0dce3db89168ff9986d70d13586e427736d0657936bbfad7004169905e2c170",
          "version": "20260106150000"
        },
        {
          "path": "backend/src/main/resources/db/migration/V20260108100000__add_item_pedido_id_to_movimento_estoque.sql",
          "sha256": "sha256:ac9b878c976c98443baa05c5d847696a482e874dafd04ad781da959befd4428a",
          "version": "20260108100000"
        },
        {
          "path": "backend/src/main/resources/db/migration/V20260108110000__add_movimento_origem_id_to_movimento_estoque.sql",
          "sha256": "sha256:2ab303bf8bea7d07607c08c6bec23aa130e0f13e40ce50b23798462f0512f391",
          "version": "20260108110000"
        },
        {
          "path": "backend/src/main/resources/db/migration/V20260108120000__create_estoque_lote_table.sql",
          "sha256": "sha256:bf7bc36b322d203b551495989b22c5d5b60a9ece0db18e6a6a6db6506808c313",
          "version": "20260108120000"
        },
        {
          "path": "backend/src/main/resources/db/migration/V20260108120001__create_movimento_estoque_lote_table.sql",
          "sha256": "sha256:9a0c0bbc83af00d624dbfa05a469065a89b1eae07744697fa0b6fa55126f0b92",
          "version": "20260108120001"
        },
        {
          "path": "backend/src/main/resources/db/migration/V20260108120002__add_controla_validade_to_produto.sql",
          "sha256": "sha256:cace41d551fcc238fd129ea68f103e6ad45f555a90abd9a51b24fa22e4a745cf",
          "version": "20260108120002"
        },
        {
          "path": "backend/src/main/resources/db/migration/V20260108130000__add_vida_util_dias_to_produto.sql",
          "sha256": "sha256:72f3d2bb6614d75a9d953ebbdd2c952776f7bc019781ee2e77c6af3fc27f1e03",
          "version": "20260108130000"
        },
        {
          "path": "backend/src/main/resources/db/migration/V20260108140000__adjust_estoque_lote_nullable_sem_lote_unique.sql",
          "sha256": "sha256:d1aa255c3eacb95f7c99f6b5a6305291301e44a5ddb7c94daff32db0f8b3d20c",
          "version": "20260108140000"
        },
        {
          "path": "backend/src/main/resources/db/migration/V20260109100000__create_tarefa_validade_tables.sql",
          "sha256": "sha256:e6a26f53d97456cc120a5b8bf91b3152f68507dffcbc1474a35373ab0239a244",
          "version": "20260109100000"
        },
        {
          "path": "backend/src/main/resources/db/migration/V20260112090000__add_cliente_id_to_delivery_order.sql",